{
  "schemaVersion": "1.0.0",
  "editionYear": 2026,
  "title": {
    "id": "title-47",
    "number": "47",
    "name": "Land and Land Titles"
  },
  "removedDocumentIds": [
    "section-47-34a",
    "section-47-36aa",
    "section-47-36ddd",
    "section-47-257",
    "section-47-261b",
    "section-47-264",
    "section-47-271"
  ],
  "documents": [
    {
      "id": "section-47-34a",
      "citation": "47-34a",
      "citations": [
        "47-34a"
      ],
      "heading": "Sec. 47-34a. Unlawful destruction, disturbance or removal of surveyor's marker or monument.",
      "chapter": {
        "id": "chapter-821",
        "number": "821",
        "name": "Land Titles"
      },
      "status": "active",
      "text": "(a) Any person who knowingly injures, destroys, disturbs or removes any marker properly placed on any tract of land or street or highway line by a surveyor, or by any person at the direction of a surveyor, for the purpose of designating any point, course or line in the boundary of such tract of land, street or highway, shall be fined not less than five hundred dollars or more than one thousand dollars.\n\n(b) Notwithstanding the provisions of subsection (a) of this section, a surveyor licensed under chapter 391, or a person acting at the direction of any such licensed surveyor, may remove an existing marker in order to place an upgraded marker in the same location.\n\n(c) Any person who knowingly injures, destroys, disturbs or removes any monument that has been established by the National Geodetic Survey for use in the determination of spatial location relative to the Connecticut Plane Coordinate System specified in section 13a-255 or precise elevation datum shall be fined not less than two thousand dollars or more than five thousand dollars.",
      "href": "?chapter=821&section=section-47-34a",
      "supplement": {
        "editionYear": 2026,
        "presentation": "amended"
      }
    },
    {
      "id": "section-47-36aa",
      "citation": "47-36aa",
      "citations": [
        "47-36aa"
      ],
      "heading": "Sec. 47-36aa. Validations re conveyancing defects of recorded instrument, insubstantial defects, defects re power of attorney, defects re conveyance by fiduciary.",
      "chapter": {
        "id": "chapter-821b",
        "number": "821b",
        "name": "Validation of Conveyance Defects"
      },
      "status": "active",
      "text": "(a) Conveyancing defects. Any recorded deed, mortgage, lease, power of attorney, release, assignment or other instrument made for the purpose of conveying, leasing, mortgaging or affecting any interest in real property in this state, which instrument contains any one or more of the following defects or omissions is as valid as if it had been executed without the defect or omission unless an action challenging the validity of that instrument is commenced and a notice of lis pendens is recorded in the land records of the town or towns where the instrument is recorded within two years after the instrument is recorded:\n\n(1) The instrument contains a defective acknowledgment or no acknowledgment;\n\n(2) The instrument is attested by one witness only or by no witnesses;\n\n(3) In the case of a conveyance by a corporation, limited liability company, partnership, limited partnership, or limited liability partnership, or by any other entity authorized to hold and convey title to real property within this state, the instrument designated such entity as the grantor but was signed or acknowledged by an individual in the individual capacity of such person;\n\n(4) The instrument was made to any grantee not recognized by law to have the capacity to take or hold an interest in real property. Validation of an instrument under this subdivision confirms the conveyance to the grantee and any subsequent transfers of the interest by the grantee to any subsequent transferees, their heirs, successors and assigns.\n\n(b) Insubstantial defects. Any recorded deed, mortgage, lease, power of attorney, release, assignment or other instrument made for the purpose of conveying, leasing, mortgaging or affecting any interest in real property in this state, which instrument contains any one or more of the following defects or omissions is as valid as if it had been executed without the defect or omission:\n\n(1) The instrument contains an incorrect statement of the date of execution or omits the date of execution;\n\n(2) The instrument contains an execution date or other date that is later than the date of recording;\n\n(3) The instrument transfers an interest in land by reference to a filed map or subdivision plan and the map or plan does not comply as to preparation, form, certification, approval or filing with any requirement of any special or general law, municipal ordinance or regulation;\n\n(4) The instrument conveys an interest in a lot or parcel of land in a subdivision that was not submitted for approval or that was submitted for approval but was not approved;\n\n(5) The record does not disclose the date of recording;\n\n(6) The instrument does not disclose any statutorily required signature of the town clerk;\n\n(7) The instrument does not contain a statement of consideration;\n\n(8) The instrument fails to state the town and state in which the real property described in the instrument is located;\n\n(9) The instrument fails to state the current mailing address of the grantee;\n\n(10) In the case of a conveyance by a corporation, limited liability company, partnership, limited partnership or limited liability partnership, or by any other entity authorized to hold and convey title to real property within this state, the instrument designates such entity as the grantor but fails to disclose the authority of the individual who executes and acknowledges the instrument;\n\n(11) In the case of a committee deed, the judge's approval of the sale incorrectly states or fails to state the date of approval of the sale.\n\n(c) Defect with respect to a power of attorney. (1) Any recorded deed, mortgage, lease, power of attorney, release, assignment or other instrument made for the purpose of conveying, leasing, mortgaging or affecting any interest in real property in this state, which instrument is executed pursuant to a recorded power of attorney and contains any one or more of the following defects, is as valid as if it had been executed without the defect unless an action challenging the validity of that instrument is commenced and a notice of lis pendens is recorded in the land records of the town or towns where the instrument is recorded within two years after the instrument is recorded:\n\n(A) The instrument was executed by an attorney-in-fact but was signed or acknowledged by the attorney-in-fact without reference to his or her capacity;\n\n(B) The instrument was executed by an attorney-in-fact but does not reference the power of attorney;\n\n(C) The power of attorney was effective at the time the instrument was executed but is recorded after the instrument is recorded.\n\n(2) Any recorded deed, mortgage, lease, release, assignment or other instrument made for the purpose of conveying, leasing, mortgaging or affecting any interest in real property in this state, which instrument is executed pursuant to a power of attorney, but which power of attorney is not recorded on the land records of the town or towns where the instrument is recorded, is as valid as if the power of attorney had been recorded, unless (A) an action is commenced to avoid and set aside such instrument and a notice of lis pendens is recorded in the land records of the town or towns where the instrument is recorded within fifteen years from the date of recording of such instrument, or (B) such instrument fails to evidence the consideration reflecting fair market value. The provisions of this subdivision shall not apply to any conveyance where any deed, mortgage, lease, release, assignment or other instrument is executed by a fiduciary and the fiduciary is the grantee, mortgagee, leasee, releasee or assignee designated in such instrument.\n\n(d) Defect where fiduciary conveyed to self. Any recorded deed, mortgage, lease, release, assignment or other instrument made for the purpose of conveying, leasing, mortgaging or affecting any interest in real property in this state, which instrument is executed by a fiduciary, but which instrument is voidable because the fiduciary is the grantee, mortgagee, leasee, releasee or assignee designated in such instrument, is as valid as if it had been executed without the defect unless an action is commenced to avoid and set aside such instrument and a notice of lis pendens is recorded in the land records of the town or towns where the instrument is recorded within ten years from the date of recording of such instrument.\n\n(e) Defect with respect to conveyance by fiduciary. Any recorded deed, mortgage, lease, power of attorney, release, assignment or other instrument made for the purpose of conveying, leasing, mortgaging or affecting any interest in real property in this state, which instrument was executed by an executor, administrator, guardian, trustee, conservator or other fiduciary pursuant to an order or authorization of the court of probate and which contains any one or more of the following defects, is as valid as if it had been executed without the defect:\n\n(1) The fiduciary failed to post a bond required by the court for the faithful administration and distribution of the proceeds of the sale, provided either (A) the fiduciary has accounted for the proceeds of the sale in an administration account that has been approved and accepted by the court after notice and hearing, and from which order of approval and acceptance no appeal has been taken, or (B) no action challenging the validity of that instrument is commenced and no notice of lis pendens is recorded in the land records of the town or towns where the instrument is recorded within two years after the inst